73574,"Regain Charging Post, The Works Ebbw Vale",Ebbw Vale,,NP23 6YL,Blaenau Gwent,,Wales,51.764043,-3.203113
73529,"Ebbw Vale Multi-Story Car Park, Steel Works Road",Ebbw Vale,,NP23 6AA,Blaenau Gwent,,Wales,51.777559,-3.202214
13447,"Asda Brynmawr Superstore, Lakeside Retail Park",Ebbw Vale,,NP23 4SL,Blaenau Gwent,,Wales,51.7952522,-3.178753
93991,"Hutchings Bridgend-Hyundai, Trews Field Industrial Estate",Bridgend,,CF31 4LH,Bridgend,,Wales,51.51244,-3.584415
75788,"Sarn Supercharger, Sarn Park Services",Bridgend,,CF32 9SY,Bridgend,,Wales,51.535351,-3.577637
60727,"Bassett's Nissan Bridgend, South Road",Bridgend,,CF31 3UL,Bridgend,,Wales,51.4966964,-3.5617038
21125,"Sarn Park Welcome Break M4 Services, M4 Junction 36",Bridgend,,CF32 9SY,Bridgend,,Wales,51.534361,-3.576534
17159,"Best Western Heronston Hotel & Leisure Club, Ewenny Road",Bridgend,,CF35 5AW,Bridgend,,Wales,51.492119,-3.576447
115379,"MFG Texaco Ninian, Sloper Road",Cardiff,,CF11 8BN,Cardiff,,Wales,51.469647,-3.195624
108467,"Ibis Cardiff Gate, Ibis Cardiff Gate",null,,CF23 8RA,Cardiff,,Wales,51.539299,-3.131
102032,"Q-Park Cardiff Bay, Q-Park Cardiff Bay",Pierhead Street,,CF10 4PH,Cardiff,,Wales,51.465801,-3.1625
100517,"Bannatyne Health Club and Spa - Llanishen, Parc TÃ…Â· Glas",Cardiff,,CF14 5DU,Cardiff,,Wales,51.524217,-3.191847
94467,"Wessex Garages Cardiff, 289 Penarth Road",Cardiff,,CF11 8AQ,Cardiff,,Wales,51.468083,-3.206283
89133,"St David's Shopping Centre, St David's Shopping Centre Bridge Street Arcade",null,,CF10 2EQ,Cardiff,,Wales,51.479103,-3.174819
66622,"Ibis Budget Hotel Cardiff Centre, Tyndall Street",Cardiff,,CF10 4BE,Cardiff,,Wales,51.4771015,-3.166845
61225,"St. David's Shopping Centre Car Park, Hills Street",Cardiff,,CF10 2EQ,Cardiff,,Wales,51.47922,-3.1747675
53260,"NCP Wood Street, Wood Street",Cardiff,,CF10 1EN,Cardiff,,Wales,51.476601,-3.17853
53109,"NCP Greyfriars Road, Greyfriars Road",Cardiff,,CF10 3AD,Cardiff,,Wales,51.483101,-3.17577
47590,"Renault Cardiff, 295 Penarth Road",Cardiff,,CF11 8UU,Cardiff,,Wales,51.4626971,-3.193859736
47592,"NCP Dumfries Place, Dumfries Place",Cardiff,,CF10 3FN,Cardiff,,Wales,51.478001,-3.16922
21124,"Cardiff West Moto M4 Services (Travelodge), Cardiff West Moto M4 Services",Cardiff,,CF72 8SA,Cardiff,,Wales,51.508924,-3.306719
19576,"Cardiff Gate Welcome Break M4 Services, M4 Junction 30",Cardiff,,CF23 8RA,Cardiff,,Wales,51.5391667,-3.13
19049,"289 Penarth Road, 289 Penarth Road",Cardiff,,CF11 8TT,Cardiff,,Wales,51.46102,-3.19667
16626,"G24 Innovations, Newlands Road",Newport,,CF3 2GH,Cardiff,,Wales,51.506864,-3.101256
13450,"ASDA Cardiff Coryton Supercentre, 1 Longwood Drive",Cardiff,,CF14 7EW,Cardiff,,Wales,51.524136,-3.242433
9711,"Wessex Garages Cardiff, Hadfield Road",Cardiff,,CF11 8AQ,Cardiff,,Wales,51.4665486,-3.2017036
53256,"NCP Pellet Street, Pellet Street",Cardiff,,CF10 4FF,Cardiff,,Wales,51.478298,-3.17032
112710,"Castle Car Park, Castle Street",Llandovery,,SA20 0AN,Carmarthenshire,,Wales,51.9934529,-3.7955441
106534,"The Cawdor, Rhosmaen Street",Llandeilo,,SA19 6EN,Carmarthenshire,,Wales,51.882965,-3.992978
99590,"Calsonic Kansei UK LTD, Llethri Road",Carmarthenshire,,SA14 8HU,Carmarthenshire,,Wales,51.699438,-4.14244
99549,"St Peter's Street Car Park, St Peter's Street",Carmarthen,,SA31 1LN,Carmarthenshire,,Wales,51.859087,-4.303028
99545,"Mart Car Park, New Road",Newcastle Emlyn,,SA38 9BA,Carmarthenshire,,Wales,52.037951,-4.470243
96022,"Roadhouse Restaurant, Abbey Road",Whitland,,SA34 0LG,Carmarthenshire,,Wales,51.82519554,-4.594688416
88583,"FRF Toyota Carmarthen, Morfa Lane",Carmarthen,,SA31 3AX,Carmarthenshire,,Wales,51.854153,-4.313407
75714,"Parc-Y-Scarlets, Pemberton Retail Park",Llanelli,,SA14 9UZ,Carmarthenshire,,Wales,51.678578,-4.127873
73666,"The Browns B&B, King Street",Laugharne,,SA33 4RY,Carmarthenshire,,Wales,51.77100283,-4.462243893
43724,"Murray Street Multi-Storey Car Park, Murray Street",Llanelli,,SA15 1BQ,Carmarthenshire,,Wales,51.68137023,-4.161007404
43719,"Nant y Ci Park and Ride, Nant-y-Ci",Carmarthen,,SA31 3RS,Carmarthenshire,,Wales,51.84714243,-4.349684715
43642,"J & J Motors Nissan, Crosshands Business Park",Llanelli,,SA14 6RB,Carmarthenshire,,Wales,51.793387,-4.0774524
23586,"The Plash Inn, Llanfallteg",Whitland,,SA34 0UN,Carmarthenshire,,Wales,51.84777399,-4.678996831
21127,"Pont Abraham Roadchef M4 Services, M4 Junction 49",Llanedi,,SA4 0FU,Carmarthenshire,,Wales,51.747708,-4.06528
15813,"Nant yr Onnen Holiday Lets, Nant yr Onnen",Llandovery,,SA20 0PE,Carmarthenshire,,Wales,52.084978,-3.800958
15809,"Home Farm, Dinefwr Park & Castle",Llandeilo,,SA19 6RT,Carmarthenshire,,Wales,51.88818,-4.008486
113266,"Blue Grass Cottages, Brynglas Farm",Aberystwyth,,SY23 4DF,Ceredigion,,Wales,52.37022858,-4.085910641
107734,"Welsh Government, Rhodfa Padarn",Penparcau,,SY23 3UR,Ceredigion,,Wales,52.40792636,-4.071886379
104108,"Cletwr Car Park, Tynywern",Machynlleth,,SY20 8PN,Ceredigion,,Wales,52.51256216,-3.975621099
103834,"Ynyshir Restaurant and Rooms, Ynyshir Restaurant and Rooms Eglwys Fach",Machynlleth,,SY20 8TA,Ceredigion,,Wales,52.544703,-3.944609
103692,"Pwllhai Car Park, Morgan Street",Aberteifi,,SA43 1DF,Ceredigion,,Wales,52.08286883,-4.659663235
91299,"Nanteos Mansion, Rhydyfelin",Aberystwyth,,SY23 4LU,Ceredigion,,Wales,52.388265,-4.028988
11789,"The Falcondale, Falcondale Drive",Lampeter,,SA48 7RX,Ceredigion,,Wales,52.123233,-4.099074
113977,"Conwy Council Offices (c/o A&b Engineering), Conwy Council Offices (c/o A&b Engineering)",1 Coed Pella Road,,LL29 8LP,Conwy,,Wales,53.29549,-3.730253
103614,"North Wales Holiday Cottages-Penrhyn Beach West, 47 Penrhyn Beach West",Llandudno,,LL30 3NW,Conwy,,Wales,53.318655,-3.775531
103576,"North Wales Holiday Cottages-Rosebery Avenue, 20 Rosebury Avenue",Llandudno,,LL30 1TF,Conwy,,Wales,53.320192,-3.808713
102570,"Central Promenade, Central Promenade",Promenade,,LL29 8HH,Conwy,,Wales,53.297707,-3.727103
102473,"The Furnace House Bodnant Estate, The Furnace House Bodnant Estate",Mill Lane Tal y Cafn,,LL28 5RP,Conwy,,Wales,53.233032,-3.804948
99811,"The Groes Inn, Llanrwst Road",Conwy,,LL32 8TN,Conwy,,Wales,53.24907,-3.834715
97941,"Gwesty Links Hotel, 77 Conway Road",Llandudno,,LL30 1PN,Conwy,,Wales,53.316729,-3.818743
95979,"Dyffryn Mymbyr Farm House, A4086",Betws Y Coed,,LL24 0ET,Conwy,,Wales,53.0965886,-3.9502153
89295,"Threeways Garage LTD-Hyundai, Faenol Avenue",Conwy,,LL22 7HT,Conwy,,Wales,53.284676,-3.571898
75603,"Elen's Castle Hotel and Restaurant, Elen's Castle Hotel and Restaurant",Dolwyddelan,,LL25 0EJ,Conwy,,Wales,53.054727,-3.885812
75187,"Imperial Hotel, The Promenade",Llandudno,,LL30 1AP,Conwy,,Wales,53.323206,-3.823826
49636,"Puffin Cafe and Deli, Orme View Filling Station",Penmaenmawr,,LL34 6UN,Conwy,,Wales,53.273103,-3.9161082
47824,"Waterloo Hotel and Lodge, Betws-y-Coed",Snowdonia,,LL24 0AR,Conwy,,Wales,53.087573,-3.798897
24479,"The Imperial Hotel, The Promanade",Llandudno,,LL30 1AP,Conwy,,Wales,53.322964,-3.824116
19538,"Slaters Nissan, Market Street",Abergele,,LL22 7AL,Conwy,,Wales,53.283948,-3.578531
16947,"St. George's Hotel, The Promenade",Conwy,,LL30 2LG,Conwy,,Wales,53.3229158,-3.8231377
11670,"Bryn Bella Guest House, Llanwrst Road",Betws y Coed,,LL24 0HD,Conwy,,Wales,53.09198453,-3.793175107
9701,"Sychnant Pass Country House, Sychnant Pass Road",Conwy,,LL32 8BJ,Conwy,,Wales,53.277924,-3.869384
99841,"Williams Haulage, Old Station Road",Denbighshire,,LL21 0LB,Denbighshire,,Wales,52.959505,-3.408876
86347,"Design Reality LTD, 81 Bowen Court",St. Asaph,,LL17 0JE,Denbighshire,,Wales,53.254619,-3.477075
86136,"Rhug Estate, Farm Shop Car Park",Denbighshire,,LL21 0EH,Denbighshire,,Wales,52.981389,-3.411742
24880,"Trefnant Village Hall, Bodfari Road",Denbighshire,,LL16 4UH,Denbighshire,,Wales,53.223051,-3.416036
113054,"Tesco Car Park (outside Holywell Town Council Offices), Bank Place Offices",Flintshire,,CH8 7TJ,Flintshire,,Wales,53.27431247,-3.22090182
104745,"Dandy's Topsoil, Sealand Road",Chester,,CH1 6BS,Flintshire,,Wales,53.205904,-2.955098
98075,"Glan Yr Afon Inn, Milwr",Holywell,,CH8 8HE,Flintshire,,Wales,53.255279,-3.20757
97525,"Tesni Properties LTD, Linden House",Mold,,CH7 1XP,Flintshire,,Wales,53.155561,-3.132727
94182,"Moneysupermarket House, St David's Park",Ewloe,,CH5 3UZ,Flintshire,,Wales,53.188852,-3.052412
88993,"Moneysupermarket House, St David's Park",Ewloe,,CH5 3UZ,Flintshire,,Wales,53.188852,-3.052412
42513,"Euro Garages Singing Kettle, St. Asaph Road",Holywell,,CH8 8RF,Flintshire,,Wales,53.273686,-3.305466
114317,"Pant du, Ffordd Y Sir (county Road)",Penygroes,,LL54 6HE,Gwynedd,,Wales,53.053461,-4.271632
109538,"Black Boy Inn, Black Boy Inn",null,,LL55 1RW,Gwynedd,,Wales,53.141267,-4.275942
108851,"Bryn Elltyd Eco Guesthouse, Bryn Elltyd",Blaenau Ffestiniog,,LL41 3TW,Gwynedd,,Wales,52.984863,-3.966485
108381,"The Boathouse, B4410",Maentwrog,,LL41 3AQ,Gwynedd,,Wales,52.95089871,-4.01688646
98300,"Cynfal Farm Cottages, Bryncrug",Tywyn,,LL36 9RB,Gwynedd,,Wales,52.59677,-4.051771
97957,"Tyn Y Cornel Hotel, Tal-Y-Llyn",Tywyn,,LL36 9AJ,Gwynedd,,Wales,52.667401,-3.903532
97949,"Glyn Y Coed Hotel, Porthmadog Road",Criccieth,,LL52 0HP,Gwynedd,,Wales,52.920238,-4.230054
96271,"Portmeirion, Woodland Walk",Portmeirion,,LL48 6ER,Gwynedd,,Wales,52.914337,-4.098481
91274,"Bryncir Garden Centre and Cafe, Bryncir",Garndolbenmaen,,LL51 9LX,Gwynedd,,Wales,52.974161,-4.263637
75602,"Bryn Elltyd Eco Guesthouse, Bryn Elltyd",Blaenau Ffestiniog,,LL41 3TW,Gwynedd,,Wales,52.984863,-3.966485
75333,"Hendy Farm Holidays, A493",Tywyn,,LL36 9RU,Gwynedd,,Wales,52.591718,-4.077471
75332,"Gelli Goch Cottages, A470",Blaenau Ffestiniog,,LL41 4YD,Gwynedd,,Wales,52.845328,-3.909768
75331,"Byrdir Self Catering Cottages, Byrdir",Dyffryn Ardudwy,,LL44 2EA,Gwynedd,,Wales,52.797666,-4.08135
75330,"Corris Caverns Ltd, A487",Machynlleth,,SY20 9RF,Gwynedd,,Wales,52.65357772,-3.848629567
75329,"Railway Cottage B&B, Glan Tryweryn",Bala,,LL23 7NT,Gwynedd,,Wales,52.9405606,-3.636229898
74714,"Royal Sportsman Hotel, 131 High Street",Gwynedd,,LL49 9HB,Gwynedd,,Wales,52.928395,-4.133445
52493,"Euro Garages, A5/55 Expressway",Bangor,,LL57 4BG,Gwynedd,,Wales,53.20389,-4.10562
49641,"Glasfryn Parc, Y-FFor",Pwllheli,,LL53 6PG,Gwynedd,,Wales,52.949278,-4.391481
43818,"Beautiful Wales Limited, Ceilwart Ganol Farm",Gwynedd,,LL42 1YS,Gwynedd,,Wales,52.734163,-4.066443
43975,"Porthdinllaen National Trust Car Park, Golf Road",Morfa Nefyn,,LL53 6BE,Gwynedd,,Wales,52.932754,-4.569173
43979,"National Trust Plas yn Rhiw Car Park, ",Rhiw Pwllheli,,LL53 8AB,Gwynedd,,Wales,52.824955,-4.619585
43983,"National Trust Car Park Porthor / Whistling Sands, Fferm Carreg",Aberdaron,,LL53 8LH,Gwynedd,,Wales,52.82657,-4.725515
43984,"National Trust Car Park Llanbedrog, ",Pwllheli,,LL53 7TT,Gwynedd,,Wales,52.854821,-4.481781
26062,"National Trust Coastal Toursim Centre of Excellence (Henfaes Centre Porth y Swnt), Henfaes",Pwllheli,,LL53 8BE,Gwynedd,,Wales,52.80467033,-4.7126811
23612,"National Trust Canolfan Deilan Las, Craflwyn Hall",Gwynedd,,LL55 4NG,Gwynedd,,Wales,53.018057,-4.093377
19903,"Asda Bangor, Farrar Road",Bangor,,LL57 1LJ,Gwynedd,,Wales,53.224037,-4.131161
16847,"Tudor Lodge, Tan yr Onnen",Porthmadog,,LL49 9NY,Gwynedd,,Wales,52.9284681,-4.1382057
16537,"National Trust Penrhyn Castle, Bangor",Gwynedd,,LL57 4HN,Gwynedd,,Wales,53.2306175,-4.1079916
13594,"Royal Sportsman Hotel, 131 High Street",Porthmadog,,LL49 9HB,Gwynedd,,Wales,52.928375,-4.133205
13374,"Bryn Elltyd Eco Guest House, Bryn Elltyd",Blaenau Ffestiniog,,LL41 3TW,Gwynedd,,Wales,52.983971,-3.966376
91380,"Sygun Fawr Country House, Beddgelert",Caernarfon,,LL554NE,Gwynedd,,Wales,53.015329,-4.089655
115335,"Anglesey Sea Zoo, Brynsiencyn",null,,LL61 6TQ,Isle of Anglesey,,Wales,53.160588,-4.284513
109653,"Plas Coch Holiday Park, Plas Coch Holiday Park",null,,LL61 6EJ,Isle of Anglesey,,Wales,53.190417,-4.233559
99763,"Trearddur Bay Hotel, Lon Isallt",Trearddur Bay,,LL65 2UN,Isle of Anglesey,,Wales,53.280792,-4.622538
98372,"House in the Yard, House in the Yard - Tyn Y Buarth Llangaffo",Gaerwen,,LL60 6LY,Isle of Anglesey,,Wales,53.18761,-4.340583
98310,"Anglesey Arms, Anglesey Arms",null,,LL59 5EA,Isle of Anglesey,,Wales,53.22272,-4.166325
95596,"The Bull - Beaumaris, The Bull",null,,LL58 8AP,Isle of Anglesey,,Wales,53.263608,-4.091592
95464,"Canolfan Beaumaris, Rating Row",Beaumaris,,LL58 8AL,Isle of Anglesey,,Wales,53.265,-4.093173
93769,"Chateau Rhianfa, Beaumaris Road",Menai Bridge,,LL59 5NS,Isle of Anglesey,,Wales,53.2382,-4.14395
66643,"Ye Olde Bulls Head Inn, Castle Street",Beaumaris,,LL58 8AP,Isle of Anglesey,,Wales,53.263507,-4.091703
65154,"TDL Event Services, Unit 1 & 2 Pen-Yr-Orsedd",Llangefni,,LL77 7AW,Isle of Anglesey,,Wales,53.2530834,-4.3072753
48147,"Anglesey Outdoor Centre, Porthdafarch Road",Holyhead,,LL65 2LP,Isle of Anglesey,,Wales,53.293697,-4.644256
47125,"Holyhead Clock Tower, Port of Holyhead",Holyhead,,LL65 1DQ,Isle of Anglesey,,Wales,53.30933,-4.627999
24478,"Tre-Ysgawen Hall Country House Hotel and Spa, Capel Coch",Llangefni,,LL77 7UR,Isle of Anglesey,,Wales,53.312394,-4.315945
23607,"National Trust Plas Newydd Country House and Gardens, Llanfairpwll",Anglesey,,LL61 6DQ,Isle of Anglesey,,Wales,53.20218,-4.229495
23610,"National Trust Tywyn Cemaes Cottage, ",Anglesey,,LL67 0ND,Isle of Anglesey,,Wales,53.413432,-4.44845
5658,"Irish Ferries, Onboard Holyhead-Dublin crossings",Holyhead,,LL65 1DR,Isle of Anglesey,,Wales,53.3156229,-4.6248245
47469,"ASDA Merthyr Tydfil Superstore, Dowlais Top",Merthyr Tydfil,,CF48 2YF,Merthyr Tydfil,,Wales,51.766998,-3.34144
103946,"The Angel Hotel, The Angel Hotel Cross Street",Monmouth,,NP7 5EN,Monmouthshire,,Wales,51.821228,-3.017742
72864,"Bridges Centre, Wonastow Road",Monmouth,,NP25 5AS,Monmouthshire,,Wales,51.80945847,-2.723362192
52377,"Private Drive, 45 Monmouth Road",Abergavenny,,NP7 5HH,Monmouthshire,,Wales,51.81880771,-3.014040612
47514,"Hampton By Hilton Newport East, Wales One Business Park",Magor,,NP26 3DG,Monmouthshire,,Wales,51.5851395,-2.8446682
47512,"ASDA Caldicot Supermarket, Woodstock Way",Caldicot,,NP26 5DB,Monmouthshire,,Wales,51.590218,-2.749694
21121,"Magor Roadchef M4 Services, M4 Junction 23A",Caldicot,,NP26 3YL,Monmouthshire,,Wales,51.587923,-2.836206
9568,"Llansantffraed Court Hotel, Clytha",Nr Abergavenny,,NP7 9BA,Monmouthshire,,Wales,51.7813,-2.937782
68097,"Brunel Way, Brunel Way",Neath Port Talbot,,SA11 2GG,Neath Port Talbot,,Wales,51.624874,-3.8298357
49166,"The Quays, Brunel Way",Briton Ferry,,SA11 2GG,Neath Port Talbot,,Wales,51.62485,-3.82818
42219,"Asda Ystalyfera, Glanyrafon",Godrergraig,,SA9 2DE,Neath Port Talbot,,Wales,51.76025545,-3.790135913
10418,"Aberavon Beach Hotel, Princess Margaret Way",Neath Port Talbot,,SA12 6QP,Neath Port Talbot,,Wales,51.593603,-3.814883
113189,"Holiday Inn Express Newport, Lakeside Drive",Newport,,NP10 8BB,Newport,,Wales,51.5606,-3.0361
108936,"Kingsway Shopping Centre, John Frost Square",Newport,,NP20 1HY,Newport,,Wales,51.5849366,-2.9930234
105704,"Holiday Inn Newport, The Coldra",Newport,,NP18 2YG,Newport,,Wales,51.600069,-2.927657
102503,"Wessex Newport-Hyundai, Seven Styles Avenue",Newport,,NP19 4QR,Newport,,Wales,51.575345,-2.944849
102104,"Park Square MSCP, Park Square",Newport,,NP20 4EN,Newport,,Wales,51.58409,-2.995132
100976,"Civic Centre-Newport, Godfrey Road",Newport,,NP20 4UR,Newport,,Wales,51.589288,-3.005291
100857,"Bannatyne Health Club & Spa - Newport, 5 Enterprise Way",Newport,,NP20 2AJ,Newport,,Wales,51.57949315,-2.985945237
100830,"Holiday Inn Newport, Holiday Inn Newport",The Coldra,,NP18 2YG,Newport,,Wales,51.599899,-2.9279
91254,"Capitol Skoda, Leeway Industrial Estate",Gwent,,NP19 4SL,Newport,,Wales,51.568227,-2.950055
72900,"Ibis Budget Hotel Newport, Malpas Road",Newport,,NP20 5PP,Newport,,Wales,51.601677,-3.004369
31735,"National Trust Tredegar House, ",Newport,,NP10 8YW,Newport,,Wales,51.561601,-3.028106
16840,"Celtic Manor Resort, Coldra Woods",Newport,,NP18 1HQ,Newport,,Wales,51.6022056,-2.9313871
113701,"MFG Texaco Withybush, Withybush Retail Park",Haverfordwest,,SA61 2PY,Pembrokeshire,,Wales,51.811799,-4.964129
113132,"Victoria Filling Station, 41 Great North Road",Milford Haven,,SA73 2NA,Pembrokeshire,,Wales,51.71452946,-5.028496071
109608,"Hotel Plas Hyfryd, Moorfield RD",Narberth,,SA67 7AB,Pembrokeshire,,Wales,51.800553,-4.745481
105404,"Dial Cottage - Holiday Cottage, Dial Cottage",Pembroke,,SA71 5NU,Pembrokeshire,,Wales,51.668633,-4.87044
100031,"Druidstone Hotel, The Druidstone",Haverfordwest,,SA62 3NE,Pembrokeshire,,Wales,51.809787,-5.101992
93322,"St. Brides Spa Hotel, St. Brides Spa Hotel",Saundersfoot,,SA69 9NH,Pembrokeshire,,Wales,51.7089,-4.6982
93324,"The Grove of Narberth, The Grove of Narberth",Narberth,,SA67 8BX,Pembrokeshire,,Wales,51.782833,-4.763913
92880,"Coast Restaurant, Coast Restaurant Coppet Hall Beach",Saundersfoot,,SA69 9AJ,Pembrokeshire,,Wales,51.71642,-4.693882
92641,"Park Hotel, Park Hotel",null,,SA708AT,Pembrokeshire,,Wales,51.678292,-4.709391
92356,"Gravels Kia, Redstone road",Narberth,,SA67 7ES,Pembrokeshire,,Wales,51.80757991,-4.743947983
90451,"PMS Nissan, Salutation Square",Haverfordwest,,SA61 2LG,Pembrokeshire,,Wales,51.802796,-4.963712
75217,"TWR Y Felin Hotel, Caerfai Road",St David's,,SA62 6QT,Pembrokeshire,,Wales,51.87956846,-5.260287563
75215,"Penrhiw Hotel, Penrhiw",St Davids,,SA62 6PG,Pembrokeshire,,Wales,51.8868554,-5.2694971
75214,"Roch Castle, Church Road",Roch,,SA62 6AQ,Pembrokeshire,,Wales,51.8491785,-5.0790147
52875,"Oriel y Parc National Park visitors centre, Ffordd Caerfai",St. David's,,SA62 6QT,Pembrokeshire,,Wales,51.88034571,-5.259672403
48671,"County Hall Car Park, County Hall",Haverfordwest,,SA61 1TP,Pembrokeshire,,Wales,51.80071,-4.96587
48229,"Caerfai Farm, Ffordd Caerfai",St. Davids,,SA62 6QT,Pembrokeshire,,Wales,51.87379275,-5.258221064
48144,"National Trust Ysgubor Fawr Mathry, Mathry",Haverfordwest,,SA62 5HE,Pembrokeshire,,Wales,51.9476151,-5.0924674
47620,"Hammet House, Llechryd",Cardigan,,SA43 2QA,Pembrokeshire,,Wales,52.061206,-4.607759
43653,"Silverstone Green Energy, Units 5 and 6 Rushacre Enterprise Park",Narberth,,SA67 7ET,Pembrokeshire,,Wales,51.80556322,-4.743754864
41885,"Riverside Multistorey Car Park, Cartlett Road",Haverfordwest,,SA61 2LJ,Pembrokeshire,,Wales,51.80332851,-4.966772656
24868,"Pembroke Dock Ferry Terminal, Irish Ferries Ltd",Pembroke Port,,SA72 6UF,Pembrokeshire,,Wales,51.696411,-4.952045
16540,"National Trust Stackpole Centre, Stackpole Estate",Pembrokeshire,,SA71 5DQ,Pembrokeshire,,Wales,51.622719,-4.927462
91406,"Bluestone National Park Resort, Bluestone National Park Resort",Cresselly,,SA678DE,Pembrokeshire,,Wales,51.783396,-4.801274
115289,"The Grange Guest House, 22 Watton",Brecon,,LD3 7ED,Powys,,Wales,51.945524,-3.386893
109147,"Glynnmeddig Barn, Glynmeddig Barn Pentrefelin",Sennybridge,,LD3 8UA,Powys,,Wales,51.970089,-3.582229
109115,"Caer Beris Manor Hotel & Restaurant, Caer Beris Manor Hotel & Restaurant",null,,LD2 3NP,Powys,,Wales,52.145899,-3.419994
106449,"Brecon Beacons National Park - Ffrwdgrech Depot, Ffrwdgrech Ind. Estate",Brecon,,LD3 8LA,Powys,,Wales,51.94238786,-3.410614704
103929,"The Neuadd Cottages, Llangattock",Crickhowell,,Np8 1LE,Powys,,Wales,51.847417,-3.155876
102332,"Baskerville Hall Hotel, Clyro Court",Powys,,HR3 5LE,Powys,,Wales,52.07872,-3.156996
101869,"The Grange Guest House, 22 Watton",Brecon,,LD3 7ED,Powys,,Wales,51.86795,0.169746
100787,"Bronllys Service Station, Bronllys",Brecon,,LD3 0LE,Powys,,Wales,52.00803858,-3.245824805
99902,"Beacons Business Interiors, Beacons Business Interiors",Brecon,,LD3 8LA,Powys,,Wales,51.941422,-3.411703
92674,"Brecon Retreat - Aberyscir, Brecon Retreat",Aberyscir,,LD3 9NP,Powys,,Wales,51.965554,-3.452627
90538,"Horseshoe Guesthouse, Church Street",Rhayader,,LD6 5AT,Powys,,Wales,52.300341,-3.51307
89385,"Midcounties Co-Operative-Churchstoke, Crosslikely",Powys,,SY15 6AR,Powys,,Wales,52.537365,-3.063015
88411,"Old Tredegar, 33 Heol Gwys CWM Twrch",Swansea,,SA9 2XG,Powys,,Wales,51.786649,-3.804058
82771,"Little Chef - Builth Wells, Station Road",Builth Wells,,LD2 3SS,Powys,,Wales,52.153214,-3.401135
48143,"Dragon Inn (Crickhowell) Ltd, 47 High Street",Crickhowell,,NP8 1BE,Powys,,Wales,51.8578633,-3.1381913
25048,"Gregynog Hall, Tregynon",Powys,,SY16 3PW,Powys,,Wales,52.5687286,-3.3485279
24550,"Peterstone Court Hotel, Llanhamlach",Powys,,LD3 7YB,Powys,,Wales,51.928518,-3.325382
24551,"The Manor, Brecon Road",Powys,,NP8 1SE,Powys,,Wales,51.866013,-3.140576
21576,"Unit 5, Unit 5d Parc Derwen Fawr",Llanidloes,,SY18 6FE,Powys,,Wales,52.448017,-3.532981
20428,"The Old Coach House, Dolcorsllwyn",Machynlleth,,SY20 9AB,Powys,,Wales,52.666035,-3.708239
19664,"The Hall Farm, The Hall Farm",Crickhowell,,NP8 1ET,Powys,,Wales,51.8438342,-3.1026063
19279,"Luxury Lodges Wales, Luxury Lodges Wales",Caersws,,SY17 5PU,Powys,,Wales,52.500142,-3.5297553
18932,"Glanusk Services, Sennybridge",Brecon,,LD3 8PS,Powys,,Wales,51.9439578,-3.5748008
17164,"Gwaenynog Farmhouse B&B & Campsite, Dolanog",Powys,,SY21 0LJ,Powys,,Wales,52.690813,-3.362396
17160,"Rhedyn Guest House, The Rhedyn",Builth Wells,,LD2 3LH,Powys,,Wales,52.145953,-3.477849
16416,"The Metropole Hotel, Temple Street",Llandrindod,,LD1 5DY,Powys,,Wales,52.240102,-3.377296
16206,"National Trust Powis Castle Gardens, Welshpool",Powys,,SY21 8RF,Powys,,Wales,52.650608,-3.1582288
13406,"The Old Sunday School Room, Traianglas",Brecon,,LD3 8YE,Powys,,Wales,51.934416,-3.658689
13376,"YHA Danywenallt National Park, Near Talybont Reservoir",Brecon,,LD3 7YS,Powys,,Wales,51.87657,-3.297848
13250,"Carno Community Centre, Carno",Caersws,,SY17 5LH,Powys,,Wales,52.556942,-3.535001
11780,"Dan-yr-Ogof Caves, Dan-yr-Ogof",Abercrave,,SA9 1GJ,Powys,,Wales,51.829337,-3.682848
11778,"Elan Valley Visitor Centre, Elan Valley",Rhayader,,LD6 5HP,Powys,,Wales,52.271923,-3.565589
11673,"Drover Holidays / Drover Cycles, Forest Road",Hay on Wye,,HR3 5EH,Powys,,Wales,52.073291,-3.124199
9706,"The Barn at Brynich, Brynich",Brecon,,LD3 7SH,Powys,,Wales,51.941737,-3.354432
9702,"Lon Lodges, Lon",Rhayader,,LD6 5PE,Powys,,Wales,52.300653,-3.43068
9694,"Centre for Alternative Technology, Llwyngwern Quarry",Machynlleth,,SY20 9AZ,Powys,,Wales,52.62406364,-3.838419676
9555,"Wern Watkin Bunkhouse, Wern Watkin",Crickhowell,,NP8 1LG,Powys,,Wales,51.835019,-3.150895
9490,"School Annex, c/o The Old Schoolhouse",Brecon,,LD3 7YQ,Powys,,Wales,51.896581,-3.290506
9482,"Blaenglanhanog Holiday Accommodation, Carno",Caersws,,SY17 5JU,Powys,,Wales,52.57868,-3.557032
8939,"Aberhyddnant Farm Cottages, Aberhyddnant",Brecon,,LD3 8YS,Powys,,Wales,51.900719,-3.639845
5655,"Westview Guesthouse, Llowes",Hay-on-Wye,,HR3 5JD,Powys,,Wales,52.0680845,-3.1830663
5656,"Lasswade Country House, Station Road",Llanwrtyd Wells,,LD5 4RW,Powys,,Wales,52.1063344,-3.6368661
5657,"The Old Vicarage, Dolfor",Newtown,,SY16 4BN,Powys,,Wales,52.47975599,-3.326218601
93183,"The Hyundai Centre-Hutchings Hyundai, The Hyundai Centre",Pontypridd,,CF37 5YH,Rhondda Cynon Taf,,Wales,51.575511,-3.295223
74699,"Penderyn Distillery, Penderyn",Penderyn,,CF44 0SX,Rhondda Cynon Taf,,Wales,51.763688,-3.52129
54860,"Griffin Mill Garages-Nissan, Upper Boat",Pontypridd,,CF37 5YH,Rhondda Cynon Taf,,Wales,51.57472,-3.294382
105872,"The Beach House Restaurant, Oxwich Beach",Oxwich,,SA3 1LS,Swansea,,Wales,51.557063,-4.161065
100057,"Hotel Ibis Swansea, Fabian Way",Swansea,,SA1 8LD,Swansea,,Wales,51.619946,-3.912318
98151,"Croft Acre Holiday Cottages, The Rickyard Port Eynon",Swansea,,SA3 1NN,Swansea,,Wales,51.545176,-4.209902
93185,"Hutchings Hyundai Swansea, St Davids Road",Swansea,,SA6 8QL,Swansea,,Wales,51.660435,-3.913284
89311,"Morfa Shopping Park, Brunel Way",Swansea,,SA1 7DS,Swansea,,Wales,51.643032,-3.932073
86156,"Tesco Extra-Llansamlet, Nantyffin Road",Swansea,,SA7 9RD,Swansea,,Wales,51.658672,-3.901234
86119,"Sinclair Accident Repair Centre, Gorseinon Road",Swansea,,SA4 9GW,Swansea,,Wales,51.667286,-4.019841
85839,"The Dragon Hotel, 39 the Kingsway",Swansea,,SA1 5LS,Swansea,,Wales,51.621436,-3.944424
84747,"Parc le Breos House, Parc le Breos House",Swasnea,,SA3 2HA,Swansea,,Wales,51.584496,-4.124613
75345,"Swansea Marriott Hotel, Maritime Quarter",Swansea,,SA13SS,Swansea,,Wales,51.613644,-3.94421
73032,"Swansea University Taliesin Theatre, Singleton Park",Swansea,,SA2 8PP,Swansea,,Wales,51.61017,-3.979976
68096,"DVLA Swansea, Long View Road",Swansea,,SA99 1AR,Swansea,,Wales,51.6715443,-3.9440397
47823,"Down to Earth, 72a Manselfield Road",Swansea,,SA3 3AP,Swansea,,Wales,51.580598,-4.035326
19938,"F R F Toyota, Neath Road",Swansea,,SA6 8HF,Swansea,,Wales,51.660559,-3.9250447
10313,"Fairyhill, Reynoldston",Swansea,,SA3 1BS,Swansea,,Wales,51.598898,-4.214534
9566,"National Waterfront Museum, Oystermouth Road",Swansea,,SA1 3RD,Swansea,,Wales,51.61681412,-3.937885165
60758,"Bassett's Nissan Swansea, Neath Road",Swansea,,SA6 8JE,Swansea,,Wales,51.65400269,-3.927790418
21126,"Swansea West Moto M4 Services, M4 Junction 47",Swansea,,SA4 1GT,Swansea,,Wales,51.678746,-3.994655
24867,"Newtown Motors, 1-2 Mona Close",Cwmbran,,NP44 1QX,Torfaen,,Wales,51.65893,-3.017383
24584,"Newtown Motors Nissan, 12 Somerset Road",Torfaen,,NP44 1QX,Torfaen,,Wales,51.65951595,-3.017196135
19351,"Best Western Plus Parkway Hotel & Spa, Cwmbran Drive",Newport,,NP44 3UW,Torfaen,,Wales,51.6435932,-3.022374
101485,"Barry Power Station, Sully Moors Road",Sully,,CF64 5YU,Vale of Glamorgan,,Wales,51.409163,-3.228540096
47460,"ASDA Barry Superstore, Ffordd y Mileniwm",Barry,,CF62 5AT,Vale of Glamorgan,,Wales,51.397175,-3.278613
24498,"National Trust Dyffryn Gardens, St Nicholas",Vale of Glamorgan,,CF5 6SU,Vale of Glamorgan,,Wales,51.437563,-3.304228
112903,"Ruthin Road, Ruthin Road",Wrexham,,LL13 7TU,Wrexham,,Wales,53.044518,-3.010819
93248,"Ramada Plaza Wrexham, Ramada Plaza Wrexham",Ellice Way,,LL13 7YH,Wrexham,,Wales,53.050201,-3.0121
47588,"Lindop Toyota, Llay New Road",Wrexham,,LL11 4BA,Wrexham,,Wales,53.076496,-3.004565
